id,name,tags,problem,solution,action,files,tech-stack,causeIds,effectIds,last-commit-short-sha,created-at,updated-at,model,created-by-agent
f290a4d6-7eef-4c43-aebb-f9b1569a7b7b,Code Review of llm-lean-log,"review,architecture,typescript",Review source code structure and implementation,"Comprehensive code review of monorepo with core, CLI, and visualizer packages","Analyzed project architecture, reviewed key files, assessed code quality","packages/core/src/,packages/cli/src/,packages/visualizer/src/","typescript,bun,react,vite",,,unknown,2026-01-14T17:26:18.006Z,,,Cascade
1c5c20c7-4d1c-47ba-9b75-6bddcbea927e,Updated Common Rules Documentation,"documentation,rules,logging",Update common rules with proper git SHA and installation instructions,"Added before-run checklist with CLI installation, help command, and git SHA retrieval","Updated .windsurf/rules/common.md, .agent/rules/common.md, and README.md with enhanced logging instructions",".windsurf/rules/common.md,.agent/rules/common.md,README.md","markdown,bash,git",,,c0f1c7d,2026-01-14T17:33:24.066Z,,,Cascade
6ec1964d-722e-4f0b-8c34-322d767765ae,Import LogEntry type from llm-lean-log-core,"refactoring,typescript,dependencies",LogEntry interface was defined locally in visualizer package instead of importing from core package,Removed local LogEntry interface definition and imported from llm-lean-log-core package,"Updated types.ts to import LogEntry from core package, added dependency to package.json, installed dependency with bun i","packages/visualizer/src/types.ts,packages/visualizer/package.json","typescript,bun,monorepo",,,12cb0ce,2026-01-14T19:37:25.819Z,,,Cascade
af16485f-e1ad-4853-b522-9df95be18eb5,Fix TypeScript errors for optional LogEntry fields,"typescript,bugfix,utilities",TypeScript errors when passing optional LogEntry fields to utility functions,Updated parseTags and extractCode functions to accept string | undefined parameters,"Modified utils.ts to handle optional fields, added null checks, verified TypeScript compilation",packages/visualizer/src/utils.ts,"typescript,react",,,12cb0ce,2026-01-14T19:43:31.609Z,,,Cascade
cfbba996-4c06-4739-9d4b-c49b265617ac,Fix CLI package.json for npm publication,"npm,package,build,typescript","CLI package.json had incorrect entry points, missing build script, and wrong file configuration","Added build script, updated main/module/bin fields to point to dist files, fixed files field to include dist instead of src, added prepublishOnly script","Modified package.json and tsconfig.json, tested build process, verified generated files in dist folder","packages/cli/package.json,packages/cli/tsconfig.json","npm,typescript,bun",,,f5dccd5,2026-01-15T05:57:42.461Z,,,Cascade
2f3fca63-9299-42fd-8fc7-2ce650c64bed,convert lang-smith.md to full markdown,"docs,markdown,vi",Inconsistent and non-standard markdown formatting in lang-smith.md,"Formatted the file with proper markdown tables, code blocks (JSON and text), and standard horizontal rules",Updated docs/other-languages/vi/lang-smith.md with improved markdown structure,docs/other-languages/vi/lang-smith.md,markdown,,,f5dccd5,2026-01-15T06:33:39.765Z,,,Antigravity
51075a35-9949-4a7c-b44c-3c2faa2c3f61,Create Memory MCP roadmap documentation,"documentation,roadmap,mcp,memory",Need to document the relationship between llm-lean-log and Memory MCP,Created roadmap document explaining how llm-lean-log integrates with Memory MCP for long-term storage and retrieval,Added memory-mcp.md to docs/roadmap/ with conceptual framework and integration patterns,docs/roadmap/memory-mcp.md,"markdown,documentation",,,aec6c06,2026-01-15T06:57:36.640Z,,,Cascade