id,name,tags,problem,solution,action,files,tech-stack,causeIds,effectIds,last-commit-short-sha,created-at,updated-at,model,created-by-agent
62b5edfa-6503-4873-abb4-ccf542bcd142,API Authentication Error,"error,api,auth",Users unable to login due to JWT token expiration not being handled correctly,Added token refresh logic with exponential backoff retry mechanism,Updated auth.ts middleware and added refresh endpoint,,,,,,2026-01-12T05:53:16.093Z,2026-01-12T05:53:16.107Z,claude-3.5-sonnet,gpt-4
1ffeb37a-adcf-415e-ac21-ec96ea8cdada,Database Connection Pool Exhausted,"error,database,performance",Application crashes during high traffic due to database connection pool being exhausted,Increased pool size from 10 to 50 and added connection timeout handling,"Modified database.config.ts: ts`pool.max = 50, pool.idleTimeoutMillis = 30_000`",,,,,,2026-01-12T05:53:16.093Z,,gpt-4-turbo,
afa40756-0820-4cf9-a66a-ad97e495e31f,Implement Dark Mode,"feature,ui,enhancement",Users requested dark mode for better viewing experience at night,Implemented theme toggle using CSS variables and localStorage for persistence,Created theme.ts utility and updated global.css with dark mode variables,,,,,,2026-01-12T05:53:16.093Z,,claude-3.5-sonnet,
0fe90dc0-c8fb-4a54-b538-55d860ffaf4f,Memory Leak in WebSocket Handler,"bug,websocket,memory",Server memory usage grows continuously when WebSocket connections are active,Fixed event listener cleanup in disconnect handler to prevent memory leaks,Added `removeAllListeners()` call in `websocket.disconnect()`,,,,,,2026-01-12T05:53:16.093Z,,gpt-4,
af1fba6a-967b-4289-beab-13223069890d,Optimize Image Loading,"performance,optimization,images",Page load time is slow due to large unoptimized images,Implemented lazy loading and WebP format with fallback to JPEG,Added next/image component and configured image optimization in next.config.js,,,,,,2026-01-12T05:53:16.093Z,,claude-3.5-sonnet,
f3cff7e9-44c8-4753-b131-61341d72d5f8,TypeScript Migration Complete,"refactor,typescript,milestone",Codebase was in JavaScript making it hard to catch type errors,Migrated entire codebase to TypeScript with strict mode enabled,"Converted all .js files to .ts, added type definitions, configured tsconfig.json",,,,,,2026-01-12T05:53:16.093Z,,gpt-4-turbo,
9c6ed81e-feea-4c52-8f9b-e2baa8c04a58,Make @llm-lean-log packages public,"npm,release,monorepo","Packages were not configured for NPM publication (missing bin, repository, files, and publishConfig fields).","Updated package.json for both packages, added LICENSE and README.md files, and configured cli as executable.",Updated packages per NPM requirements and created docs/public.md,,,,,,2026-01-12T07:10:41.115Z,,gemini-1.5-flash-001,gemini-1.5-flash-001
783e86ef-9a4c-4cf7-b24b-d1b1b8958819,Test Tech Stack,test,Testing tech-stack field,,,src/index.ts,"bun,typescript,react",,,,2026-01-12T18:03:15.375Z,,,